問題番号,質問,選択肢A,選択肢B,選択肢C,正解,解説,ヒント
1,大きくて強い肉食恐竜で、短い前あしが特徴的なのは次のうちどれでしょう？,トリケラトプス,ティラノサウルス,プテラノドン,B,ティラノサウルス（T-Rex）は、大きな体と短い前あしが特徴の肉食恐竜です。,「恐竜の王様」とも呼ばれる、とても有名で人気の恐竜です。
2,顔に3本の角を持つ草食恐竜は次のうちどれでしょう？,ステゴサウルス,トリケラトプス,ブラキオサウルス,B,トリケラトプスは、名前の「トリ」が「3」を意味するように、顔に3本の角を持つ植物食の恐竜です。,名前の「トリ」は数字の3という意味があります。
3,ブラキオサウルスのように首がとても長く、高い木の葉っぱを食べていた恐竜は、肉食恐竜と草食恐竜のどちらでしょう？,肉食恐竜,草食恐竜,雑食恐竜,B,木の葉っぱや草などの植物を食べる恐竜は、草食恐竜と呼ばれます。,「草」食恐竜は、何を食べる恐竜でしょうか？
4,大昔にほとんどの恐竜がいなくなってしまった一番大きな理由として、科学者が考えているのは次のうちどれでしょう？,恐竜同士のケンカが激しすぎたから,地面がとても冷たくなってしまったから,大きな隕石が地球にぶつかったから,C,巨大な隕石が地球に衝突し、その後に起きた環境の変化が恐竜の絶滅の主な原因という説が最も有力です。,宇宙から飛んできた、とても大きなものが関係しています。
5,次の恐竜の名前の中で、「恐竜」（Dinosaur）ではないものはどれでしょう？,スピノサウルス,プテラノドン,ヴェロキラプトル,B,プテラノドンは空を飛ぶ翼竜（よくりゅう）の仲間で、正確には「恐竜」には分類されません。,この生き物は、翼を広げて空を飛ぶことができました。